[
  {
    "id": "claude",
    "name": "Claude Code",
    "vendor": "Anthropic",
    "desc": "终端里的 AI 编程搭档：读代码库、改 bug、跑命令、提提交",
    "homepage": "https://www.anthropic.com/claude-code",
    "runtime": "node",
    "runtimeWinget": "OpenJS.NodeJS.LTS",
    "runtimeLabel": "Node.js LTS",
    "install": {
      "kind": "npm",
      "package": "@anthropic-ai/claude-code"
    },
    "bin": "claude",
    "pathExtra": [
      "%ProgramFiles%\\nodejs",
      "%APPDATA%\\npm"
    ],
    "env": [
      {
        "name": "ANTHROPIC_AUTH_TOKEN",
        "label": "API Key / Token",
        "placeholder": "sk-ant-...",
        "secret": true,
        "required": true,
        "hint": "console.anthropic.com 或你的中转服务商",
        "url": "https://console.anthropic.com/"
      },
      {
        "name": "ANTHROPIC_BASE_URL",
        "label": "Base URL（可选，中转/代理）",
        "placeholder": "https://your-relay.example.com",
        "hint": "直连官方 API 可留空"
      }
    ],
    "concerns": [
      "closed",
      "data",
      "restriction"
    ]
  },
  {
    "id": "codex",
    "name": "Codex CLI",
    "vendor": "OpenAI",
    "desc": "OpenAI 官方终端编程智能体，轻量、可审阅改动",
    "homepage": "https://github.com/openai/codex",
    "runtime": "node",
    "runtimeWinget": "OpenJS.NodeJS.LTS",
    "runtimeLabel": "Node.js LTS",
    "install": {
      "kind": "npm",
      "package": "@openai/codex"
    },
    "bin": "codex",
    "pathExtra": [
      "%ProgramFiles%\\nodejs",
      "%APPDATA%\\npm"
    ],
    "env": [
      {
        "name": "OPENAI_API_KEY",
        "label": "OpenAI API Key",
        "placeholder": "sk-...",
        "secret": true,
        "required": true,
        "hint": "platform.openai.com",
        "url": "https://platform.openai.com/api-keys"
      },
      {
        "name": "OPENAI_BASE_URL",
        "label": "Base URL（可选）",
        "placeholder": "https://api.openai.com/v1"
      }
    ],
    "concerns": [
      "data",
      "restriction"
    ]
  },
  {
    "id": "gemini",
    "name": "Gemini CLI",
    "vendor": "Google",
    "desc": "Google 开源终端智能体，免费额度慷慨",
    "homepage": "https://github.com/google-gemini/gemini-cli",
    "runtime": "node",
    "runtimeWinget": "OpenJS.NodeJS.LTS",
    "runtimeLabel": "Node.js LTS",
    "install": {
      "kind": "npm",
      "package": "@google/gemini-cli"
    },
    "bin": "gemini",
    "pathExtra": [
      "%ProgramFiles%\\nodejs",
      "%APPDATA%\\npm"
    ],
    "env": [
      {
        "name": "GEMINI_API_KEY",
        "label": "Gemini API Key",
        "placeholder": "AIza...",
        "secret": true,
        "required": true,
        "hint": "aistudio.google.com 免费申请",
        "url": "https://aistudio.google.com/apikey"
      }
    ],
    "concerns": [
      "data",
      "restriction"
    ]
  },
  {
    "id": "qwen",
    "name": "Qwen Code",
    "vendor": "阿里通义",
    "desc": "通义千问编程 CLI，国内直连、中文友好",
    "homepage": "https://github.com/QwenLM/qwen-code",
    "runtime": "node",
    "runtimeWinget": "OpenJS.NodeJS.LTS",
    "runtimeLabel": "Node.js LTS",
    "install": {
      "kind": "npm",
      "package": "@qwen-code/qwen-code"
    },
    "bin": "qwen",
    "pathExtra": [
      "%ProgramFiles%\\nodejs",
      "%APPDATA%\\npm"
    ],
    "env": [
      {
        "name": "OPENAI_API_KEY",
        "label": "DashScope API Key",
        "placeholder": "sk-...",
        "secret": true,
        "required": true,
        "hint": "dashscope.console.aliyun.com",
        "url": "https://dashscope.console.aliyun.com/apiKey"
      },
      {
        "name": "OPENAI_BASE_URL",
        "label": "Base URL",
        "defaultValue": "https://dashscope.aliyuncs.com/compatible-mode/v1"
      },
      {
        "name": "OPENAI_MODEL",
        "label": "模型",
        "defaultValue": "qwen3-coder-plus"
      }
    ],
    "concerns": [
      "data"
    ]
  },
  {
    "id": "aider",
    "name": "Aider",
    "vendor": "开源社区",
    "desc": "老牌开源 AI 结对编程工具，支持 DeepSeek 等百家模型",
    "homepage": "https://aider.chat/",
    "runtime": "python",
    "runtimeWinget": "Python.Python.3.13",
    "runtimeLabel": "Python 3.13",
    "install": {
      "kind": "pip",
      "package": "aider-chat"
    },
    "bin": "aider",
    "pathExtra": [
      "%LOCALAPPDATA%\\Programs\\Python\\Python313",
      "%LOCALAPPDATA%\\Programs\\Python\\Python313\\Scripts"
    ],
    "env": [
      {
        "name": "OPENAI_API_KEY",
        "label": "API Key（OpenAI 或 DeepSeek 等）",
        "placeholder": "sk-...",
        "secret": true,
        "required": true,
        "hint": "按你用的模型服务商填",
        "url": "https://aider.chat/docs/llms.html"
      },
      {
        "name": "OPENAI_API_BASE",
        "label": "API Base（可选）",
        "placeholder": "https://api.deepseek.com"
      }
    ],
    "notes": [
      "首次启动后输入 /model 选择模型，详见 aider.chat 文档"
    ]
  },
  {
    "id": "ollama",
    "name": "Ollama",
    "vendor": "开源社区",
    "desc": "本地跑开源大模型：零密钥、零联网、数据不出机",
    "homepage": "https://ollama.com/",
    "runtime": "none",
    "install": {
      "kind": "winget",
      "package": "Ollama.Ollama"
    },
    "bin": "ollama",
    "pathExtra": [
      "%LOCALAPPDATA%\\Programs\\Ollama"
    ],
    "env": [],
    "keepOpen": true,
    "notes": [
      "安装后服务自动后台运行；终端里 ollama run qwen3 即可拉模型开聊"
    ]
  },
  {
    "id": "dsh",
    "name": "DeepSeek Harness",
    "vendor": "DeepSeek",
    "desc": "DeepSeek 官方智能体运行时：万物皆插件，Web 端开箱即用",
    "homepage": "https://deepseek.com/harness",
    "runtime": "node",
    "runtimeWinget": "OpenJS.NodeJS.LTS",
    "runtimeLabel": "Node.js LTS",
    "install": {
      "kind": "npm",
      "package": "@deepseek-ai/dsh"
    },
    "bin": "dsh",
    "pathExtra": [
      "%ProgramFiles%\\nodejs",
      "%APPDATA%\\npm"
    ],
    "env": [
      {
        "name": "DEEPSEEK_API_KEY",
        "label": "DeepSeek API Key（可选）",
        "placeholder": "sk-...",
        "secret": true,
        "hint": "platform.deepseek.com；也可启动后在 Web 端配置",
        "url": "https://platform.deepseek.com/api_keys"
      }
    ],
    "webPort": 8080,
    "launchArgs": [
      "web",
      "--port",
      "8080"
    ],
    "notes": [
      "Web 端首次启动会自动初始化 profile；点「启动」拉起本地服务并自动打开浏览器"
    ],
    "concerns": [
      "closed",
      "data"
    ]
  },
  {
    "id": "workbuddy",
    "name": "WorkBuddy CLI",
    "vendor": "WorkBuddy",
    "desc": "WorkBuddy 官方终端智能体，任务编排与执行一体化",
    "homepage": "https://www.npmjs.com/package/@workbuddy/cli-vnext",
    "runtime": "node",
    "runtimeWinget": "OpenJS.NodeJS.LTS",
    "runtimeLabel": "Node.js LTS",
    "install": {
      "kind": "npm",
      "package": "@workbuddy/cli-vnext"
    },
    "bin": "workbuddy-vnext",
    "pathExtra": [
      "%ProgramFiles%\\nodejs",
      "%APPDATA%\\npm"
    ],
    "env": [],
    "keepOpen": true,
    "notes": [
      "首次运行按终端提示登录账号"
    ],
    "concerns": [
      "closed",
      "data",
      "restriction"
    ]
  },
  {
    "id": "kimi-code",
    "name": "Kimi Code CLI",
    "vendor": "月之暗面",
    "desc": "Moonshot 官方编程智能体，Kimi K2 模型加持，国内直连",
    "homepage": "https://www.kimi.com/",
    "runtime": "none",
    "install": {
      "kind": "winget",
      "package": "MoonshotAI.KimiCodeCLI"
    },
    "bin": "kimi-code",
    "pathExtra": [],
    "env": [
      {
        "name": "MOONSHOT_API_KEY",
        "label": "Moonshot API Key（可选）",
        "placeholder": "sk-...",
        "secret": true,
        "hint": "platform.moonshot.cn；也可启动后交互登录",
        "url": "https://platform.moonshot.cn/console/api-keys"
      }
    ],
    "desktopNames": [
      "Kimi Code CLI",
      "Kimi Code",
      "Kimi"
    ],
    "concerns": [
      "closed",
      "data",
      "restriction"
    ]
  },
  {
    "id": "doubao",
    "name": "豆包",
    "vendor": "字节跳动",
    "desc": "字节跳动 AI 助手桌面端：对话、写作、绘图、编程全能",
    "homepage": "https://www.doubao.com/",
    "runtime": "none",
    "install": {
      "kind": "winget",
      "package": "ByteDance.Doubao"
    },
    "bin": "doubao",
    "pathExtra": [],
    "env": [],
    "desktopNames": [
      "豆包",
      "Doubao"
    ],
    "concerns": [
      "closed",
      "data",
      "restriction"
    ]
  },
  {
    "id": "yuanbao",
    "name": "腾讯元宝",
    "vendor": "腾讯",
    "desc": "腾讯混元大模型桌面助手，微信生态文件直读",
    "homepage": "https://yuanbao.tencent.com/",
    "runtime": "none",
    "install": {
      "kind": "winget",
      "package": "Tencent.Yuanbao"
    },
    "bin": "yuanbao",
    "pathExtra": [],
    "env": [],
    "desktopNames": [
      "腾讯元宝",
      "元宝",
      "Yuanbao"
    ],
    "concerns": [
      "closed",
      "data",
      "restriction"
    ]
  },
  {
    "id": "coze",
    "name": "扣子",
    "vendor": "字节跳动",
    "desc": "扣子智能体平台桌面端：零代码搭自己的 AI 应用",
    "homepage": "https://www.coze.cn/",
    "runtime": "none",
    "install": {
      "kind": "winget",
      "package": "ByteDance.Coze"
    },
    "bin": "coze",
    "pathExtra": [],
    "env": [],
    "desktopNames": [
      "扣子",
      "Coze"
    ],
    "concerns": [
      "closed",
      "data",
      "restriction"
    ]
  },
  {
    "id": "copilot",
    "name": "GitHub Copilot CLI",
    "vendor": "GitHub",
    "desc": "GitHub 官方终端智能体：写代码、改 bug、操作仓库一气呵成",
    "homepage": "https://github.com/features/copilot/cli",
    "runtime": "node",
    "runtimeWinget": "OpenJS.NodeJS.LTS",
    "runtimeLabel": "Node.js LTS",
    "install": {
      "kind": "npm",
      "package": "@github/copilot"
    },
    "bin": "copilot",
    "pathExtra": [
      "%ProgramFiles%\\nodejs",
      "%APPDATA%\\npm"
    ],
    "env": [
      {
        "name": "GH_TOKEN",
        "label": "GitHub Token（可选）",
        "placeholder": "ghp_...",
        "secret": true,
        "hint": "留空则启动后交互登录 GitHub 账号",
        "url": "https://github.com/settings/tokens"
      }
    ],
    "concerns": [
      "closed",
      "data",
      "restriction"
    ]
  },
  {
    "id": "opencode",
    "name": "OpenCode",
    "vendor": "开源社区",
    "desc": "人气开源终端编程智能体：模型自由切换，TUI 交互丝滑",
    "homepage": "https://opencode.ai/",
    "runtime": "node",